filename,title,board,link,style
pin-01-ornate-black-ornate-medallion-sidelights.png,Black Ornate Steel Front Door with Medallion Detail,ornate,https://steelr.co.uk/collection/steelr-black-ornate-medallion-sidelights,panel
pin-02-traditional-navy-traditional-brass-fanlight.png,Navy Blue Traditional Steel Front Door with Brass Fanlight,traditional,https://steelr.co.uk/collection/steelr-navy-traditional-brass-fanlight,panel
pin-03-traditional-black-traditional-doctor-knocker-canopy.png,Black Traditional Steel Front Door with Doctor Knocker,traditional,https://steelr.co.uk/collection/steelr-black-traditional-doctor-knocker-canopy,panel
pin-04-traditional-cream-traditional-lion-knocker-topiary.png,Cream Traditional Steel Front Door with Lion Knocker,traditional,https://steelr.co.uk/collection/steelr-cream-traditional-lion-knocker-topiary,panel
pin-05-panelled-sage-panelled-arched-wreath.png,Sage Green Arched Panelled Steel Front Door,panelled,https://steelr.co.uk/collection/steelr-sage-panelled-arched-wreath,panel
pin-06-traditional-olive-traditional-arched-surround.png,Olive Green Arched Steel Front Door with Stone Surround,traditional,https://steelr.co.uk/collection/steelr-olive-traditional-arched-surround,panel
pin-07-contemporary-black-contemporary-ribbed-topiary.png,Black Contemporary Ribbed Steel Front Door,contemporary,https://steelr.co.uk/collection/steelr-black-contemporary-ribbed-topiary,panel
pin-08-colour-ideas-red-traditional-lion-knocker.png,Statement Red Traditional Steel Front Door,colour-ideas,https://steelr.co.uk/collection/steelr-red-traditional-lion-knocker,panel
pin-09-panelled-black-panelled-double-fingerprint.png,Black Panelled Double Steel Door with Fingerprint Access,panelled,https://steelr.co.uk/collection/steelr-black-panelled-double-fingerprint,panel
pin-10-panelled-taupe-panelled-dual-sidelights.png,Taupe Panelled Steel Front Door with Dual Sidelights,panelled,https://steelr.co.uk/collection/steelr-taupe-panelled-dual-sidelights,panel
pin-11-contemporary-walnut-ribbed-columns.png,Walnut Ribbed Contemporary Steel Front Door,contemporary,https://steelr.co.uk/collection/steelr-walnut-ribbed-columns,panel
pin-12-panelled-grey-panelled-stone-surround.png,Grey Panelled Steel Front Door with Stone Surround,panelled,https://steelr.co.uk/collection/steelr-grey-panelled-stone-surround,panel
pin-13-ornate-cobalt-ornate-lion-knocker.png,Cobalt Blue Ornate Steel Front Door,ornate,https://steelr.co.uk/collection/steelr-cobalt-ornate-lion-knocker,panel
pin-14-contemporary-champagne-arched-geometric-double.png,Champagne Arched Geometric Double Steel Front Door,contemporary,https://steelr.co.uk/collection/steelr-champagne-arched-geometric-double,panel
pin-15-traditional-black-traditional-timber-canopy.png,Black Traditional Steel Front Door with Timber Canopy,traditional,https://steelr.co.uk/collection/steelr-black-traditional-timber-canopy,panel
pin-16-contemporary-espresso-contemporary-gold-inlay.png,Espresso Contemporary Steel Front Door with Gold Inlay,contemporary,https://steelr.co.uk/collection/steelr-espresso-contemporary-gold-inlay,panel
pin-17-contemporary-charcoal-contemporary-horizontal-double.png,Charcoal Horizontal Line Contemporary Steel Door,contemporary,https://steelr.co.uk/collection/steelr-charcoal-contemporary-horizontal-double,panel
pin-18-traditional-black-traditional-stained-glass.png,Black Traditional Steel Front Door with Stained Glass,traditional,https://steelr.co.uk/collection/steelr-black-traditional-stained-glass,panel
pin-19-panelled-navy-panelled-lanterns-fanlight.png,Navy Panelled Steel Front Door with Lanterns,panelled,https://steelr.co.uk/collection/steelr-navy-panelled-lanterns-fanlight,panel
pin-20-ornate-black-ornate-checkerboard-canopy.png,Black Ornate Checkerboard Steel Front Door,ornate,https://steelr.co.uk/collection/steelr-black-ornate-checkerboard-canopy,panel
pin-21-panelled-grey-panelled-lever-handle.png,Grey Panelled Steel Front Door with Lever Handle,panelled,https://steelr.co.uk/collection/steelr-grey-panelled-lever-handle,panel
pin-22-ornate-black-ornate-lion-knocker-gable.png,Black Ornate Steel Front Door with Gable Porch,ornate,https://steelr.co.uk/collection/steelr-black-ornate-lion-knocker-gable,panel
pin-23-colour-ideas-sage-contemporary-bar-handle-sidelight.png,Sage Green Contemporary Steel Front Door,colour-ideas,https://steelr.co.uk/collection/steelr-sage-contemporary-bar-handle-sidelight,panel
pin-24-security-black-panelled-grille-sidelights.png,Black Panelled Steel Door with Decorative Grille,security,https://steelr.co.uk/collection/steelr-black-panelled-grille-sidelights,panel
pin-25-ornate-black-ornate-circular-fluted.png,Ornate Circular Fluted Steel Door,ornate,https://steelr.co.uk/collection/steelr-black-ornate-circular-fluted,overlay
pin-26-contemporary-black-contemporary-dual-sidelights.png,Contemporary Steel Door with Dual Sidelights,contemporary,https://steelr.co.uk/collection/steelr-black-contemporary-dual-sidelights,overlay
pin-27-panelled-olive-panelled-ring-knocker-sidelight.png,Olive Panelled Steel Door with Ring Knocker,panelled,https://steelr.co.uk/collection/steelr-olive-panelled-ring-knocker-sidelight,overlay
pin-28-traditional-black-traditional-lion-knocker-sidelights-garden.png,Black Traditional Steel Door with Lion Knocker,traditional,https://steelr.co.uk/collection/steelr-black-traditional-lion-knocker-sidelights-garden,overlay
pin-29-contemporary-navy-contemporary-square-knocker.png,Navy Contemporary Steel Door with Square Knocker,contemporary,https://steelr.co.uk/collection/steelr-navy-contemporary-square-knocker,overlay
pin-30-panelled-black-panelled-ring-knocker-recessed.png,Black Panelled Steel Door with Ring Knocker,panelled,https://steelr.co.uk/collection/steelr-black-panelled-ring-knocker-recessed,overlay
pin-31-contemporary-grey-contemporary-horizontal-slots.png,Grey Contemporary Steel Door with Horizontal Slots,contemporary,https://steelr.co.uk/collection/steelr-grey-contemporary-horizontal-slots,overlay
pin-32-colour-ideas-teal-panelled-glass-hallway.png,Teal Panelled Steel Door with Glass Panels,colour-ideas,https://steelr.co.uk/collection/steelr-teal-panelled-glass-hallway,overlay
pin-33-traditional-charcoal-traditional-oval-window-lantern.png,Charcoal Traditional Steel Door with Oval Window,traditional,https://steelr.co.uk/collection/steelr-charcoal-traditional-oval-window-lantern,overlay
pin-34-ornate-black-ornate-double-gable.png,Double Ornate Steel Front Doors with Gable,ornate,https://steelr.co.uk/collection/steelr-black-ornate-double-gable,overlay
pin-35-contemporary-black-contemporary-sunburst.png,Black Contemporary Steel Door with Sunburst Detail,contemporary,https://steelr.co.uk/collection/steelr-black-contemporary-sunburst,overlay
pin-36-traditional-black-traditional-glazed-double.png,Black Traditional Glazed Double Steel Doors,traditional,https://steelr.co.uk/collection/steelr-black-traditional-glazed-double,overlay
pin-37-traditional-olive-traditional-brass-pendant.png,Olive Green Traditional Steel Door with Brass Pendant,traditional,https://steelr.co.uk/collection/steelr-olive-traditional-brass-pendant,overlay
pin-38-traditional-black-traditional-doctor-knocker-railings.png,Black Traditional Steel Door with Iron Railings,traditional,https://steelr.co.uk/collection/steelr-black-traditional-doctor-knocker-railings,overlay
pin-39-contemporary-black-contemporary-panelled-sidelights.png,Contemporary Panelled Steel Door with Sidelights,contemporary,https://steelr.co.uk/collection/steelr-black-contemporary-panelled-sidelights,overlay
pin-40-ornate-black-ornate-lion-knocker-sidelights.png,Black Ornate Steel Door with Lion Knocker,ornate,https://steelr.co.uk/collection/steelr-black-ornate-lion-knocker-sidelights,overlay
